{
  "complete": true,
  "findings": [],
  "generated_at": "2026-09-06T01:34:16+00:00",
  "project": "/Users/simongonzalezdecruz/workspaces/checkyourself",
  "receipts": [
    {
      "captured_output": ".checkyourself/challenge-runs/S11.capture.json",
      "captured_output_digest": "5fc05ba0c0c7baca9fc1575dbd59550a377adb9636c8c2a5d27b452fd916c847",
      "challenge_config_digest": "328b87aa75977ee5d00afbcf5302ceba171ea67aaa1e32a512ec4f4536e4eeb8",
      "command": [
        "python3",
        "-c",
        "import re, subprocess, sys; result = subprocess.run([sys.executable, '-m', 'pytest', 'tests/', '-q'], capture_output=True, text=True); sys.stdout.write(re.sub(r'(?m)( in )\\d+(?:\\.\\d+)?s$', r'\\1<stable>s', result.stdout)); sys.stderr.write(result.stderr); raise SystemExit(result.returncode)"
      ],
      "cwd": ".",
      "execution_error": "",
      "exit_code": 0,
      "local_integrity_hmac": "cee3b5372e84b165490e51a81a6793e414b1deee69610c41d63bd395b9553f61",
      "receipt_path": ".checkyourself/challenge-runs/S11.receipt.json",
      "receipt_sha256": "2432a6bf5419cab6dd907014eac8bed4f61ad9e7ae6cb3ccba948b45a1fe484d",
      "receipt_type": "EXECUTED",
      "run_id": "391d117a23fd0f7e91b870c7ea0ac5aa",
      "semantic_output_digest": "b54cf38478479c15703cc36de59f2c0afe2dd1210f12d87060df217643e3d31f",
      "source_revision": "2daf5786c3c0fee8cb695626c58a113622b265e8445586a16cd217d17d9c3a33",
      "status": "PASS",
      "surface_id": "S11",
      "timed_out": false,
      "timestamp": "2026-09-06T01:34:16+00:00"
    }
  ],
  "schema": "checkyourself-challenge/1",
  "source_revision": "2daf5786c3c0fee8cb695626c58a113622b265e8445586a16cd217d17d9c3a33",
  "surfaces": [
    {
      "reasons": [],
      "receipt": {
        "captured_output": ".checkyourself/challenge-runs/S11.capture.json",
        "captured_output_digest": "5fc05ba0c0c7baca9fc1575dbd59550a377adb9636c8c2a5d27b452fd916c847",
        "challenge_config_digest": "328b87aa75977ee5d00afbcf5302ceba171ea67aaa1e32a512ec4f4536e4eeb8",
        "command": [
          "python3",
          "-c",
          "import re, subprocess, sys; result = subprocess.run([sys.executable, '-m', 'pytest', 'tests/', '-q'], capture_output=True, text=True); sys.stdout.write(re.sub(r'(?m)( in )\\d+(?:\\.\\d+)?s$', r'\\1<stable>s', result.stdout)); sys.stderr.write(result.stderr); raise SystemExit(result.returncode)"
        ],
        "cwd": ".",
        "execution_error": "",
        "exit_code": 0,
        "local_integrity_hmac": "cee3b5372e84b165490e51a81a6793e414b1deee69610c41d63bd395b9553f61",
        "receipt_path": ".checkyourself/challenge-runs/S11.receipt.json",
        "receipt_sha256": "2432a6bf5419cab6dd907014eac8bed4f61ad9e7ae6cb3ccba948b45a1fe484d",
        "receipt_type": "EXECUTED",
        "run_id": "391d117a23fd0f7e91b870c7ea0ac5aa",
        "semantic_output_digest": "b54cf38478479c15703cc36de59f2c0afe2dd1210f12d87060df217643e3d31f",
        "source_revision": "2daf5786c3c0fee8cb695626c58a113622b265e8445586a16cd217d17d9c3a33",
        "status": "PASS",
        "surface_id": "S11",
        "timed_out": false,
        "timestamp": "2026-09-06T01:34:16+00:00"
      },
      "status": "PASS",
      "surface_id": "S11"
    }
  ],
  "tool": "checkyourself-cli"
}
